{
  "parser_profile_id": "pp-naive-v2",
  "parser_id": "naive",
  "parser_config": {
    "auto_keywords": 0,
    "auto_questions": 0,
    "chunk_token_num": 128,
    "delimiter": "\\n!?;。；！？",
    "layout_recognize": true,
    "raptor": {
      "use_raptor": false
    }
  },
  "chunk_profile_id": "cp-default",
  "tenant_id": "tnt_default",
  "collection_id": "col-finance-policy",
  "version": 3
}
